{
  "connection": {
    "address": "localhost:8188"
  },
  "runtime": {
    "return": true,
    "preview": true,
    "load_workflow": false,
    "wait_timeout_minutes": 60
  },
  "models": {
    "fl2va": "",
    "ref2va": "",
    "text_encoder": "",
    "video_vae": "",
    "audio_vae": ""
  },
  "generation": {
    "width": null,
    "height": null,
    "duration_seconds": null,
    "seed": null,
    "filename_prefix": "",
    "sampler": "",
    "scheduler": "",
    "steps": null,
    "denoise": null,
    "ref_image_size": ""
  }
}
